{
  "protocolVersion": 1,
  "id": "remote-cell-spawn",
  "title": "Remote Cell spawn: satellite owner",
  "lane": "startup",
  "processes": [
    "hived",
    "bee-runtime",
    "helper"
  ],
  "owners": [
    "v2/daemon/src/daemon.ts@ed88f0b3502df5a9be45fd7caa9fcc138f30034a",
    "v2/daemon/src/loops.ts@124370ee6481c1c16fffe5c7665ce5ed83ec85cc",
    "v2/driver-cell/src/driver.ts@7e57e12b44c93a89839a1cc04f0830468c1c8d51",
    "v2/driver-cell/src/provision.ts@ba71ab86fdafde46c2950e2cdabbbbe4d7b29aad",
    "v2/driver-hsr/src/driver.ts@55f49d5743cfc7954ef399f3cfccf0c586331332",
    "v2/driver-hsr/src/runner-host.ts@7786c1b6e63fcbfbf06bc64e23be07af87d3f7d2"
  ],
  "effect": {
    "user": "A satellite Cell is provisioned at the requested revision and can accept the first message.",
    "assertions": [
      "Independent Cell checkout at pinned SHA",
      "Origin refs/HEAD/status unchanged",
      "Real stub boot precedes first delivered message",
      "No fixture runner survives cleanup"
    ],
    "exclusions": [
      "workstation dispatch and tailnet",
      "provider startup/inference",
      "repository download",
      "Apiary renderer"
    ]
  },
  "accounts": [
    {
      "inventory": "entry-points",
      "key": "entry:v2/driver-cell/src/provision.ts:provisionCell"
    },
    {
      "inventory": "entry-points",
      "key": "entry:v2/driver-cell/src/provision.ts:reserveCell"
    },
    {
      "inventory": "boundaries",
      "key": "socket:v2/cli/src/client.ts#1"
    },
    {
      "inventory": "boundaries",
      "key": "socket:v2/daemon/src/rpc.ts#1"
    },
    {
      "inventory": "resource-owners",
      "key": "spawn:v2/driver-cell/src/driver.ts#1"
    },
    {
      "inventory": "resource-owners",
      "key": "spawn:v2/driver-hsr/src/driver.ts#1"
    }
  ],
  "states": {
    "idle": {
      "matters": false,
      "why": "Separate idle workload; no spawn request."
    },
    "first-use": {
      "matters": true,
      "why": "New target repository and first runtime have distinct setup costs."
    },
    "repeated": {
      "matters": true,
      "why": "Repeated spawns reuse target repository; never call this cold disk."
    },
    "scale": {
      "matters": true,
      "why": "Single and four-wide starts are separate series."
    },
    "background": {
      "matters": false,
      "why": "No visible renderer in owner benchmark."
    },
    "release": {
      "matters": true,
      "why": "Fixture shutdown must reap every owned runner."
    },
    "recovery": {
      "matters": true,
      "why": "Failed attempts retained; retry/deduplication must preserve target and revision."
    }
  },
  "fixture": {
    "preset": "satellite-stub-202-files-v1",
    "isolationPolicy": 1,
    "scaleAxes": [
      {
        "axis": "width",
        "values": [
          1,
          4
        ]
      },
      {
        "axis": "cache",
        "values": [
          "cold",
          "warm"
        ]
      },
      {
        "axis": "target",
        "values": [
          "trmd-metal-1",
          "netcup-1"
        ]
      }
    ]
  },
  "recipe": {
    "driver": "scripts/perf/run.mjs",
    "command": "node scripts/perf/run.mjs --suite cell-spawn --cache warm --width 1 --sandbox on --samples 5 --out .proof/remote-cell-spawn/owner.json",
    "readiness": "Disposable satellite daemon RPC hello; fixture origin ready before each batch",
    "completion": "Pinned checkout, real stub idle and delivered first mail verified; owned hosts reaped",
    "reset": "cold: new fixture origin per batch; warm: one excluded batch then reuse origin; OS caches never flushed",
    "teardown": "Existing daemon fixture helper stops runtimes and verifies host exit before deleting owned temp data",
    "serial": true,
    "requires": [
      "Node 24.18.0",
      "git",
      "Linux bubblewrap or macOS sandbox-exec",
      "idle designated target for comparative baselines"
    ]
  },
  "metrics": [
    {
      "id": "cell.accept",
      "unit": "ms",
      "scope": "RPC request to durable spawn admission, including client serialization",
      "collector": "scripts/perf/run.mjs --suite cell-spawn",
      "aggregation": "median",
      "kind": "upper-bound",
      "status": "recipe-only",
      "states": [
        "first-use",
        "repeated",
        "scale"
      ],
      "betterWhen": "lower",
      "invariant": "Every measured spawn uses its own Cell at the pinned SHA, origin unchanged, first mail delivered, zero tick/delivery violations, all owned hosts reaped.",
      "noise": "15 ms polling plus RPC and scheduler delay; width 4 observations are correlated within each batch. Shared loaded host runs are recipe proof only."
    },
    {
      "id": "cell.ready",
      "unit": "ms",
      "scope": "RPC request to daemon-observed stub idle after real boot",
      "collector": "scripts/perf/run.mjs --suite cell-spawn",
      "aggregation": "median",
      "kind": "upper-bound",
      "status": "recipe-only",
      "states": [
        "first-use",
        "repeated",
        "scale"
      ],
      "betterWhen": "lower",
      "invariant": "Every measured spawn uses its own Cell at the pinned SHA, origin unchanged, first mail delivered, zero tick/delivery violations, all owned hosts reaped.",
      "noise": "15 ms polling plus RPC and scheduler delay; width 4 observations are correlated within each batch. Shared loaded host runs are recipe proof only."
    },
    {
      "id": "cell.usable",
      "unit": "ms",
      "scope": "RPC request to first mail delivery after readiness",
      "collector": "scripts/perf/run.mjs --suite cell-spawn",
      "aggregation": "median",
      "kind": "upper-bound",
      "status": "recipe-only",
      "states": [
        "first-use",
        "repeated",
        "scale"
      ],
      "betterWhen": "lower",
      "invariant": "Every measured spawn uses its own Cell at the pinned SHA, origin unchanged, first mail delivered, zero tick/delivery violations, all owned hosts reaped.",
      "noise": "15 ms polling plus RPC and scheduler delay; width 4 observations are correlated within each batch. Shared loaded host runs are recipe proof only."
    },
    {
      "id": "provisionPhasesMs",
      "unit": "ms",
      "scope": "Separate graph/copy/checkout/sandbox/runner costs",
      "collector": "none",
      "aggregation": "median",
      "kind": "actual",
      "status": "gap",
      "states": [
        "first-use",
        "repeated",
        "scale"
      ],
      "betterWhen": "lower",
      "gap": "Owner stub recipe does not collect this boundary; add bounded instrumentation/fixture before claiming coverage."
    },
    {
      "id": "providerReadyMs",
      "unit": "ms",
      "scope": "Real provider harness readiness",
      "collector": "none",
      "aggregation": "median",
      "kind": "actual",
      "status": "gap",
      "states": [
        "first-use",
        "repeated",
        "scale"
      ],
      "betterWhen": "lower",
      "gap": "Owner stub recipe does not collect this boundary; add bounded instrumentation/fixture before claiming coverage."
    },
    {
      "id": "remoteRequestToReadyMs",
      "unit": "ms",
      "scope": "Workstation dispatch through authenticated transport to remote owner",
      "collector": "none",
      "aggregation": "median",
      "kind": "actual",
      "status": "gap",
      "states": [
        "first-use",
        "repeated",
        "scale"
      ],
      "betterWhen": "lower",
      "gap": "Owner stub recipe does not collect this boundary; add bounded instrumentation/fixture before claiming coverage."
    }
  ],
  "gaps": [
    "Full transport, account leasing, repository materialization and UI are Apiary-owned; see Apiary remote-cell-spawn record.",
    "Satellite driver uses no workstation Git-image cache.",
    "Shared-host comparative receipts retained for socket wake; no exclusive-host or production-provider latency baseline."
  ],
  "updatedAt": "2026-09-17",
  "readiness": "Executable owner-side satellite stub benchmark; real provider, per-phase attribution and workstation-to-visible latency remain explicit gaps."
}
